{
  "model_version": "0.1.0",
  "model_family": "inc15d5-govman-2025-coverage",
  "source_package_id": "GOVMAN-2025-12-31",
  "source_publication_date": "2025-12-31",
  "source_original_sha256": "c1e5b58cce0a018b4995f900584605d07e473079a37d5a665a3a8ebb5d643138",
  "source_original_git_blob_sha1": "195c46a67c87ae85f1dedd423250900f119a041a",
  "source_original_repository_path": "evidence/govman-2025/originals/sha256/c1e5b58cce0a018b4995f900584605d07e473079a37d5a665a3a8ebb5d643138.xml",
  "publisher_whole_edition_entry_count": 231,
  "prior_provisional_canonical_links": 50,
  "prior_unlinked_publisher_entries": 181,
  "whole_federal_legal_institution_denominator": null,
  "current_first_level_institution_denominator": null,
  "independent_legal_review_complete": false,
  "independent_worm_custody_verified": false,
  "new_canonical_ids_minted": 0,
  "statutorily_qualified_component_identities": 0,
  "statutory_authority_verified": 0,
  "atlas_published_relationships": 0,
  "department_cohort_count": 3,
  "publisher_entries_targeted": 28,
  "publisher_entries_accounted_for": 28,
  "unaccounted_target_entries": 0,
  "source_only_pending_statutory_confirmation": 28,
  "source_only_identity_unresolved": 28,
  "prior_research_seed_correspondences": 6,
  "prior_exact_govinfo_details_references": 5,
  "prior_unreconciled_govinfo_details_references": 1,
  "canonical_component_matches": 0,
  "existing_50_provisional_links_changed": 0,
  "earlier_181_unlinked_source_entries_reclassified_as_linked": 0,
  "publisher_entry_population_is_legal_denominator": false,
  "date_is_current_institutional_authority_certification": false,
  "source_edition_additive_across_prior_editions": false,
  "items": [
    {
      "id": "INC15D5-COV-120",
      "published_department_name": "Department of the Interior",
      "publisher_department_root_key": "GOVMAN-2025-12-31:120",
      "canonical_department_anchor_id": "ORG-FED-EXE-DEP-INTERIOR",
      "publisher_full_subtree_entries": 11,
      "existing_provisional_department_root_links": 1,
      "selected_first_level_unlinked_entries": 10,
      "disposition_accounted_entries": 10,
      "new_canonical_component_matches": 0,
      "prior_research_seed_correspondences": 2,
      "prior_verified_govinfo_details_page_references": 2,
      "prior_unreconciled_govinfo_details_page_references": 0,
      "source_only_identity_unresolved": 10,
      "legal_component_identities_certified": 0,
      "independent_legal_review_complete": false,
      "observed_legal_command_relationships": 0,
      "source_date_is_current_law_certification": false
    },
    {
      "id": "INC15D5-COV-323",
      "published_department_name": "Department of Labor",
      "publisher_department_root_key": "GOVMAN-2025-12-31:323",
      "canonical_department_anchor_id": "ORG-FED-EXE-DEP-LABOR",
      "publisher_full_subtree_entries": 10,
      "existing_provisional_department_root_links": 1,
      "selected_first_level_unlinked_entries": 9,
      "disposition_accounted_entries": 9,
      "new_canonical_component_matches": 0,
      "prior_research_seed_correspondences": 2,
      "prior_verified_govinfo_details_page_references": 1,
      "prior_unreconciled_govinfo_details_page_references": 1,
      "source_only_identity_unresolved": 9,
      "legal_component_identities_certified": 0,
      "independent_legal_review_complete": false,
      "observed_legal_command_relationships": 0,
      "source_date_is_current_law_certification": false
    },
    {
      "id": "INC15D5-COV-124",
      "published_department_name": "Department of Transportation",
      "publisher_department_root_key": "GOVMAN-2025-12-31:124",
      "canonical_department_anchor_id": "ORG-FED-EXE-DEP-TRANSPORTATION",
      "publisher_full_subtree_entries": 10,
      "existing_provisional_department_root_links": 1,
      "selected_first_level_unlinked_entries": 9,
      "disposition_accounted_entries": 9,
      "new_canonical_component_matches": 0,
      "prior_research_seed_correspondences": 2,
      "prior_verified_govinfo_details_page_references": 2,
      "prior_unreconciled_govinfo_details_page_references": 0,
      "source_only_identity_unresolved": 9,
      "legal_component_identities_certified": 0,
      "independent_legal_review_complete": false,
      "observed_legal_command_relationships": 0,
      "source_date_is_current_law_certification": false
    }
  ]
}
